text,text_length,x,y
"Will it be freezing one second from now in Aragon, Pakistan",59,8.452856,-1.8509629
what is the weather forecast close-by Bermuda,45,7.9094024,-4.050981
is it going to blizzard at my current position,46,-9.086953,5.528524
How hot will be there in Kanwar Lake Bird Sanctuary tomorrow?,61,7.008705,-3.4711921
What will the weather be in Totowa Guernsey?,44,7.7014713,-3.3625271
Is it forecast to be stormy close to Nimule-Nationalpark 1 hour from now?,73,7.516071,-4.041766
is Cape Mount Nature Conservation Unit has storm weather,56,7.0181117,-3.8105237
I need the forecast for Mamaroneck in six weeks,47,7.911389,-4.462734
What's the weather in Koontz Lake,33,7.1454654,-3.777228
Ethiopia Ellenton has snow weather at eight PM,46,7.648312,-3.2129292
How will the weather be in Bhutto family mausoleum next autumn?,63,7.2994895,-3.1761954
will it be freezing in New Ringgold Nebraska,44,8.46504,-1.8415534
I'd like the weather forecast in Gang Mills four years from now.,64,7.6786757,-4.3544106
Will there be rain in 8 minutes  in MD,38,7.1990232,-3.2576523
How is faraway cloudy at 02:45 am in Brumley?,45,8.269423,-2.9046023
How will be the weather in Waltersville in one hour ?,53,7.704873,-3.0718174
Is the forecast hot in 1 hour in Leasburg ?,43,8.029326,-4.328708
Is it going to be chillier in New Mexico this spring?,53,7.204811,-2.0529978
"Tell me if there will be a snowstorm on Sep. the second, 2028 in Olpe",69,6.4574037,-3.4905498
what is the 00:00 pm forecast for blizzard conditions in Cameroon,65,8.176406,-4.275864
"What will the weather be at ten am in Fourche, NV",49,7.813974,-3.2582173
Will there be a lot of wind in West Fargo GU,44,6.8693385,-2.9331958
What's the forecast for Pipe Spring National Monument?,54,7.437591,-4.2105308
will it be stormy in Saint Pierre and Miquelon in the city of Wenham,68,6.9769382,-3.487089
Will it be overcast during meal time in NH?,43,7.2627563,-2.0109203
Will it be warmer in Saint Louis Park,37,7.346397,-2.7448118
book me a restaurant in Aransas Pass in seventeen hours,55,4.678033,3.3137147
Is it going to be warm in Cottageville,38,7.646541,-2.3014572
show weather forecast at three am.in Wauregan,45,8.273385,-4.7380624
how's the forecast looking for supper time in Dresbach Vanuatu,62,7.8968415,-4.1686916
Is it warm in Sierra Blanca now,31,7.69948,-2.4592614
"What's the weather for April 10th, 2028 in Arkansas",51,7.365804,-3.2943573
What was the weather in my current position last October,56,7.8559427,-2.895845
Is there going to be a depression in my current location on nov. the ninth,74,6.216489,-2.6075175
Will it in hail in my current position on 12/10/2035?,53,6.7321177,-2.6737726
Will it be colder in Winnebago,30,8.012691,-2.4155188
What will be the night temperate in Indiana?,44,7.9671774,-2.9817924
check the weather for around nine in South Georgia and the South Sandwich Islands,81,7.391828,-2.5986767
What's the weather forecast for the area neighboring KS this autumn?,68,7.9877353,-4.536643
Weather for Jan. 7 in North Carolina,36,7.956496,-3.8637207
Weather here at two pm,22,7.9215493,-3.2313201
What is the weather forecast for my current place?,50,8.160942,-4.5373244
What's the weather going to be like around Lewis and Clark Trail sixteen hours from now?,88,7.5911927,-2.76918
What's the weather in Oregon,28,7.90847,-2.833514
"Will it get chillier in Las Lomas, British Virgin Islands on Nov. the 21st?",75,7.353817,-2.4143915
What is the weather forecast for Winger,39,8.247978,-4.702321
What's the weather in Wisconsin on National Maritime Day,56,8.333268,-4.277084
Will it be colder in San Pablo today?,37,8.0490675,-2.3936338
Show me the forecast for Wisconsin,34,8.381216,-4.698051
"Tell me the forecast for Rogers City, MS",40,8.023337,-4.9690804
Is it rainy at the Edward L. Ryerson Conservation Area?,55,6.9942293,-3.45081
What is the weather going to be like in Epleys in South Georgia and the South Sandwich Islands in 11 months,107,7.471306,-2.95053
Will it be warmer in AMnicon Falls State Park?,46,7.459415,-2.649965
What's the weather like today in Plankinton?,44,7.995441,-3.105539
Will it be colder in Holladay Saint Kitts and Nevis,51,7.830843,-2.5048964
How will the weather be this month in OR,40,7.491502,-3.1504629
Will it get hotter in Hext?,27,7.6087995,-1.8590418
what's the weather like in El Salvador on wed.,46,7.6182866,-3.5453405
there is fog weather in Grand Lake Nebraska,43,8.00702,-3.4395616
"Find the weather prediction for Camdeboo-Nationalpark for jan. eleventh, 2037.",78,7.506321,-3.8415601
"What is the weather going to be like in Klondike Gold Rush National Historical Park on february the 28th, 2034?",111,7.2289248,-3.2542372
will there be a snowstorm in eight months at Chattahoochee River National Recreation Area,89,6.342869,-3.4272735
What is the weather forecast for Theodore Roosevelt Inaugural National Historic Site,84,7.9551444,-4.426834
what is the forecast for foggy conditions here in twenty one minutes,68,8.21548,-3.9890988
What is the humidity like in faraway on AK,42,7.0172267,-2.2776978
Is cloudy in Lyncourt?,22,8.269851,-2.9587665
What's the temperature here,27,7.873354,-2.7953522
Is it going to be chilly here,29,7.9166465,-2.2164588
Is it going to be cloudy in my current spot for dinner?,55,7.998614,-2.654824
Is it hot in the current location?,34,7.4983134,-2.089113
what is the midnight forecast for Argentina,43,7.867218,-4.4318357
what is the Jan. 8 forecast for here,36,8.017345,-4.9517365
How chilly will it get here? ,29,8.006257,-2.202412
what is the AMerican Samoa forecast for hot weather,51,8.023728,-4.1060233
"What will the weather be like not far from Alabama on May 9, 2037?",66,7.449246,-3.514081
will it be chilly in Cistern,28,7.9226027,-2.2414927
What will the weather be in Post Falls on feb. 17?,50,7.232204,-3.2832603
Will there be a cloud in the sky in 175 days from now in Golconda in VT,71,6.806193,-2.8749406
what will the weather be like in Farmington Canal State Park Trail,66,7.048438,-3.3743172
Will there be fog in Nebraska?,30,8.297692,-3.3920548
what is the weather forecast this week close-by my current position,67,8.046629,-4.2609653
Will it colder here on 11/18/2018,33,8.048821,-2.4950523
What is the forecasted humidity in Ghana for Epiphany,53,8.172257,-4.094107
Will it hail in Rush Valley Denmark on 6/21/2035,48,6.7821894,-2.6801505
What is the predicted weather on mar. 27 for Farragut State Park?,65,7.296493,-3.613811
"What's the weather forecast for TN on december seventh, 2026?",61,7.7313366,-4.2707
Will it be cold this autumn in Norfolk Island,45,7.8420763,-2.6641421
What is the weather forecast in the country of Chile fifteen hours from now,75,8.007263,-4.2699924
What will the weather be like tonight at Greenfoot Quarry,57,7.493079,-3.367574
how's the weather going to be at fourteen o'clock in Falkland Islands,69,7.5099015,-2.9685342
What is the weather for Yemen,29,7.711197,-3.6619837
What's the weather at my current location,41,7.7405114,-2.9492054
What is the weather like in Detroit Lakes,41,7.552394,-3.5444214
"what is the weather forecast for Nassau Bay, Uzbekistan",55,8.133124,-4.425459
Is it nice in PW,16,7.068402,-2.1040268
"Tell me the weather forecast for eight AM in Reminderville, FL",62,7.8834553,-4.721733
what is the ME forecast for Joanna,34,8.02858,-4.953418
Will it be cold here in one hour?,33,7.9070897,-2.306443
Is it going to be chilly at nine am in Doolittle,48,7.9558964,-2.2200484
"What's the weather forecast for East Berlin, AL?",48,8.234219,-4.491698
Is there a depression in Delta Junction,39,6.2323823,-2.628028
Is there any snowfall in Shubuta,32,6.4921107,-3.4704802
forecast for Wisconsin at 10 PM.,32,8.368336,-4.7074823
Will it be hotter in MD on apr. 10th?,37,7.58312,-1.8807449
Is it windy in Custar,21,7.279556,-3.168938
what is the weather forecast in 11 seconds for Frederick Douglass National Historic Site,88,7.710735,-4.1840467
What will the weather be like in 16 weeks at the Ivory Coast,60,7.7797885,-3.1650124
"What's the forecast for this month in Apple Grove, DC?",54,8.031327,-4.535317
What's the weather forecast not far from here? ,47,8.186162,-4.5389395
Forecast in Layhigh,19,8.031057,-5.0269747
Is it going to hail in Niger,28,7.0105834,-2.5562458
will it be chillier in Saxis North Dakota,41,7.3528886,-2.1326482
What will the weather be like at two o'clock in El Salvador,59,7.377263,-3.5272896
In Bon Secour National Wildlife Refuge at twelve pm will it be chilly,69,6.815079,-3.923901
Will it be hotter at nine am in Serbia,38,7.6997895,-2.1097355
is it cloudy here,17,8.25672,-2.9607196
what is the forecast for Montana at dinner,42,7.9955826,-4.849711
Show me the Dresden weather forecast.,37,8.211845,-4.678056
"Tell me the weather forecast for april 15, 2019 here",52,8.194428,-4.5777664
What's the weather forecast at sixteen in Oklahoma?,51,8.1534815,-4.615232
will the weather be warm in August at the faraway in Micronesia,63,7.5522356,-2.602133
"Is it hot in Gold Beach, Bahrain? ",34,7.28491,-2.252031
What's the weather forecast for Etna Green in 11 months? ,57,8.087597,-4.635732
What's the weather in South Hill,32,7.598317,-3.2885294
Is it windy in Nauru?,21,7.0231395,-2.9073434
there is warmer at Serenada,27,7.635331,-2.1318493
"When will it be warmer in White Horse, Mauritius",48,7.3863745,-2.6647925
What's the weather in Swift River Reservation,45,6.008891,2.692663
Is it cloudy in Vermont on 06:30:26 pm,38,8.152701,-2.8536184
Check the weather forecast for Pineridge.,41,7.9788713,-4.6285176
Is it going to be colder in Botswana by 09:30,45,8.010554,-2.5041265
What's the weather in La Pine,29,7.881744,-3.2567618
Tell me the weather forecast for Missouri,41,8.183819,-4.6489983
What's the weather like in Big Delta,36,7.842073,-3.1140318
What's the weather in Pennsylvania,34,7.8674493,-3.2288563
Does Wildorado have a hot temperature,37,7.5805182,-2.7374773
forecast for Conrad,19,8.138467,-4.614655
"What's the weather going to be like in Fort Point, San Francisco tomorrow?",74,7.4021363,-3.0144422
"Will it get chillier in Arkinda, Myanmar?",41,7.1576104,-2.1347625
Will it be snowy in the current place?,38,6.3174896,-3.4631145
What's the weather in Taiwan,28,8.030287,-3.0937762
what is the forecast for hot temps in Ocean Park,48,7.4207196,-4.2197533
what is the weather forecast for Kaaawa,39,8.311905,-4.6961493
What's the weather forecast for Porphyry Island Provincial Park right now,73,7.455954,-4.0086484
What is the weather going to be like this Evening in Arkansas,61,7.6231785,-3.2377372
will it be temperate in Hybla Valley Tajikistan,47,8.057335,-3.2256985
Is it hot in neighboring Algeria,32,7.7016087,-2.2411752
Is it going to be foggy at two am in Barberville,48,8.242353,-3.4300468
Tell me if the forecast will be temperate around Nationalpark Doi Suthep-Pui on 4/15/2034,89,8.075656,-3.5193164
will it rain today in Circleville,33,7.136316,-3.4025466
I want to know the weather in ten weeks from now in John N and Melba S Anderson Memorial Conservation Area,106,7.226758,-3.1017663
What is the forecasted weather for Ninaview?,44,8.207666,-4.6798463
Tell me whether Bahrain will be humid in one hour and 2 minutes ,64,7.1825385,-2.2452881
"Will it be cloudy in Lenzburg, Papua New Guinea",47,8.166631,-2.8958259
What is the forecast for 8/26/2022 in Vermont,45,7.8754406,-4.537689
Weather for here right now,26,7.9268403,-3.1429787
"Will it be warmer at 15 o'clock in Deepwater, Bonaire",53,7.3087435,-2.2789881
What will the weather be like in three weeks faraway in Sompio Strict Nature Reserve,84,7.460713,-2.8263469
Tell me the weather forecast in 4 years and a half in GA,56,8.06362,-4.5678186
What's the forecast for tonight far from East Carpathian Biosphere Reserve?,75,7.8942213,-4.2810187
What is the weather going to be at dinner time in the Lake Le-Aqua-Na State Recreation Area,91,7.176877,-3.0853846
Will it be chillier at my current location in one minute?,57,7.1753263,-2.02202
How is weather here?,20,7.9801664,-3.3071034
"Is it going to be chilly today in Abo, WI",41,7.956559,-2.2033956
"Will it be foggy in the same area of Parc provincial Kettle Lakes on february the thirteenth, 2018?",99,8.168589,-3.4211695
How is the weather in OH?,25,7.939607,-3.246886
what is the weather forecast for Shasha Forest Reserve in 43 weeks,66,7.553728,-4.2870812
Will there be a depression in the weather here on cyber monday?,63,6.2119713,-2.6186912
What's the weather in the current place?,40,7.8089943,-3.1968157
What's the weather going to be like near Sawtooth National Recreation Area at 2 pm? ,84,7.4081187,-3.2487216
What's the weather on august seventh for Crystal Lawns Guam,59,7.381079,-3.2116287
Is it hot in Bolivia,20,7.9340367,-2.8557694
Tell me the weather forecast faraway from TX,44,8.27413,-4.4049473
What's the weather going to be like here in one minute?,55,7.5503955,-2.9775572
What's the weather forecast for Delaware right now,50,8.122844,-4.6666017
Weather for Beauregard IL,25,7.290538,-3.4960814
Is snowfall forecast in PA?,27,8.202558,-4.7649417
Is it forecast to be warm in Doi Inthanon National Park?,56,7.4747314,-3.9144697
What's the forecast for the weather at eight am in Oxford?,58,8.017363,-4.730951
"How is the weather in Getzville, Minnesota?",43,7.6745996,-3.236871
Will it be hotter in Pecan Grove,32,7.627439,-1.9295653
What will the weather be in Virginia?,37,7.911857,-3.7445366
what is the forecast for the distant future in Sugar Bush,57,7.9423947,-4.7408433
Will it storm in Charles Pinckney National Historic Site,56,7.020769,-3.193145
What is the weather for my current place,40,7.7128,-2.9444444
Weather next year in Canada,27,7.610477,-3.3030307
what is the forecast for temperate weather in Bellechester,58,8.110351,-4.5505977
show weather forecast for Lewis Center,38,8.285642,-4.7565556
"Will it snow on Apr. eighteenth, 2029 in Myanmar?",49,7.010023,-3.0493526
"What will the weather be at my current location on december the 2nd, 2029",73,7.2700605,-3.1141424
Will it get chillier in 12 years  in Greenland?,47,7.4169784,-2.3699033
what's the weather going tbe twenty three minutes from now in Federico Albert National Reserve,94,7.394998,-2.8412437
What's the weather at eleven PM in Craig Mountain Wildlife Management Area,74,7.020225,-3.5128162
What's the weather forecast for Lenexa United Kingdom at 02:31,62,7.838675,-4.4017606
What was the weather last February in William A. Switzer Provincial Park?,73,7.2090116,-3.4502046
"Tell me the weather forecast for Alexander, SD",46,8.3238,-4.7287517
Will it be cold in Chatmoss Albania 8 years and a half from now,63,7.918492,-2.5409863
"Is it chilly in Charenton, NY?",30,7.891651,-2.1771288
What kind of weather is forecast around seven pm here?,54,8.168093,-4.674299
Tell me if it'll be colder in Steptoe Battlefield State Park in one minute,74,7.6131926,-2.9266071
What is the weather like at Basaseachic Falls National Park,59,7.3716054,-3.3055894
She me the forecast for Clayton Lake State Park on Oct. 17th,60,7.475627,-4.285863
What's the weather forecast for Niue at two am?,47,8.116699,-4.6132727
what is the weather of Ludowici at 4 am,39,7.646436,-3.4083896
Will it be cloudy in Tatamy?,28,8.224558,-2.882378
Show me the forecast for Anatone Louisiana on November 7th,58,7.967341,-4.261075
forecast for Antelope Island and other spots within the same area,65,7.312345,-4.336902
I need to know the weather seven weeks from now in Morgan-Monroe State Forest,77,7.593598,-2.9421868
Tell me if there will be a depression today in Kiribati,55,6.1893177,-2.6233954
Tell me the weather forecast thirteen seconds from now in Ukraine,65,8.062958,-4.3147306
Show weather forecast nearby Elk City State Park,48,7.3996415,-4.1487384
What is the forecast for West Virginia will it be snowy,55,8.154266,-4.2224264
Check the weather forecast for the current position.,52,8.014079,-4.6556897
what is the nearby forecast for here at 15:26:11,48,7.9541903,-4.9237046
what will the weather be like in Brownfield,43,7.8408375,-3.4298255
Weather for Marshall,20,7.7907557,-3.0156648
Is it freezing in Kelso,23,8.493088,-1.8333071
how much rain are we getting in current position,48,7.707455,-2.9049711
will there be a cloud next year in Kewanee,42,6.749123,-2.899603
In Morgan Mill will it be sunny,31,6.9755163,-2.704037
What will be the wind speed at the current place?,49,6.869444,-2.8517098
Will it snow in Granbury?,25,6.402326,-3.4121447
Is it warm in Vietnam,21,7.807923,-2.3203895
what is the forecast for 9 seconds from now close by here,57,7.9029646,-4.4367237
"What is the weather forecast in Ulen on mar. 2nd, 2035",54,7.8932233,-4.342879
Is it overcast in Brazil in within walking distance,51,7.09916,-3.0160666
What will the the weather be like close to Bailey's Crossroads at 05:00:34 am?,78,7.5299253,-3.0801582
What's the snowfall at noon in IN,33,6.679398,-3.4098222
is there going to be snowfall in Alton,38,6.38922,-3.4962413
what is the weather forecast for Cuba at eleven am,50,8.091046,-4.240583
Check the forecast for Natchaug State Forest,44,7.607051,-4.405258
What will the eather be here next year,38,4.9441586,1.7908009
"What is the weather forecast for July 20, 2020 in Dachigam-Nationalpark",71,7.61656,-4.107945
Will it be colder here one minute from now,42,8.027333,-2.4249752
What does it feel like in Connecticut,37,6.651984,-2.3683856
what is the six o'clock forecast for West Selmont  in Montserrat,64,7.65288,-4.3522367
What's the weather forecast for Seychelles?,43,8.357876,-4.4021387
Will it be getting colder in Sahuarita?,39,8.063328,-2.3833117
Weather for my current location tomorrow,40,7.808989,-2.9611378
at 0 AM what will the weather be here,37,7.789208,-3.4164534
Will it be freezing in seven minutes in Nora Fiji?,50,8.475412,-1.8338435
Will the sky be overcast around jan. 28 in OK?,46,6.999713,-3.0369453
what is the Oct. 10 forecast for Cuyabeno Wildlife Reserve,58,7.1755037,-4.1955457
Can you give me weather details for my current spot,51,7.763016,-3.2893121
What will the weather be like at 3 AM in Trinidad and Tobago,60,7.8165073,-3.38584
Weather for Park Narodowy Kushiro-shitsugen,43,7.348378,-3.8762
"give me the weather forecast for Lower Lake on sep. 21, 2038",60,7.5861363,-4.418311
Will it storm in North Sioux City AL,36,6.949348,-3.4321537
Is it chilly in Pixley,22,7.975382,-2.466515
"Is there a blizzard in Tennessee Colony, KS",43,-9.095198,5.536348
Is it going to rain in Tonopah?,31,7.0021305,-3.3731496
Will it be sunny in Occoquan Bay National Wildlife Refuge by tea time?,70,6.814362,-3.9285176
is the weather freezing in AK,29,8.302945,-2.134827
Weather for four weeks from now in Oregon,41,7.944366,-2.855823
what will the weather be like in Nickelsville,45,7.4797254,-3.0749838
this month will the sun be scorching in LA,42,7.5554395,-2.8089316
How is the weather going to be in Gambia in a week and a half?,62,8.109622,-3.1542788
what is the Orlovista forecast for midday within walking distance,65,7.73514,-4.1433845
what is the forecast for Wren for freezing weather,50,8.262528,-4.502661
What is the weather in Kernersville Greece?,43,7.8251,-3.084665
Will it be colder in Oswego 16 weeks from now ?,47,8.021498,-2.4527476
What will the weather be like this Week close-by Saudi Arabia,61,7.9253526,-3.1394248
Will it be windy at Medicine Rocks State Park on May 24,55,7.108706,-3.0209827
Tell me the weather forecast for WY,35,8.307599,-4.71541
Will it be stormy not far from ID on 10/2/2021,46,7.0643415,-3.5435991
What is the forecast in Lono,28,8.012951,-4.9835324
What's the weather forecast for Togo on April the 24th?,55,8.132396,-4.381245
What's the weather forecast for Arizona City?,45,8.187333,-4.8610864
"Tell me if it'll be freezing in 5 years  in Rockholds, Norfolk Island",69,8.4399605,-1.8825532
what will the weather be in Double Oak at 12 am,47,7.6730986,-3.2304513
How chilly will it be at 09:32:06 am in Moncove Lake State Park?,64,7.3269086,-2.7662823
What will the weather be like in Samoa at 6 pm,46,7.9878864,-3.6400957
Weather for Douthat State Park on Mar. 10,41,7.2563844,-3.6118526
"Will it be hotter in Conception Junction, Moldova?",50,7.636565,-2.1439526
In UT at 7 pm will it be snowy,30,6.3668895,-3.4745889
"What will the weather be in Berville AK on Feb. 6, 2017?",56,7.507571,-3.2674904
Will it be overcast at 18 o'clock in ID,39,7.0682592,-2.8040707
Will there be a depression here on october 26,45,6.1897354,-2.6163635
Is it going to be sunny at five pm in Chatyrkul Wildlife Refuge,63,6.8478355,-3.937322
"What's the forecast for Spenard, GU?",36,7.732601,-4.5430455
Is there fog in Refugio,23,8.52479,-3.3734636
What is the weather here at 7 am?,33,7.9426694,-3.2158167
is Maalaea has chillier weather,31,7.9981704,-3.094026
Will it be warmer in CT,23,7.698574,-2.0546257
Will it be nice here and in the same area,41,6.818552,-2.065039
"What will the weather be like at eight PM in Bon Air, Uruguay",61,7.7142444,-3.403877
is it going to be cold in Readstown at 4 AM,43,8.003593,-2.3522272
What is the foggy forecast for nov. 15 in France in Brookland Terrace,69,8.103878,-3.8434112
What's the weather looking like in Macy?,40,7.8108044,-3.0994215
Is there forecast to be snow in GU this summer?,47,8.267183,-4.6052995
What is forecast in Keyes Summit in New Mexico at 3 pm,54,7.914556,-4.7659035
"Will there be a lot of cloud activity next summer in Nellieburg, Arkansas",73,7.1675215,-3.0254288
Tell me the weather forecast in Greensburg,42,8.399555,-4.7507625
"Will it get rainy like last March in Hagerman, Saint Vincent and the Grenadines?",80,6.9842653,-3.464026
will it get warmer in Centenary around the Evening?,51,7.6867137,-2.415152
"Will it be warm next winter in Smolan, Burkina",46,7.9618473,-2.5605726
Will there be fog in my current position,40,8.482824,-3.3480382
What's the forecast for IL around tea time? ,44,7.9425316,-4.8547993
what is the forecast for around Putnam Lake,43,7.4354777,-4.339982
will it be hotter Netherlands Antilles Flats on april the 27th,62,7.637218,-2.2043753
Will the weather in Falcon Heights call for rain?,49,7.493819,-3.3099747
what will the weather be for Hooksett,37,7.584714,-3.158591
what is the forecast for here fir storm conditions next week,60,8.10372,-4.656218
Will it get hotter in the city of Ashford?,42,7.6046414,-1.951252
What is the weather forecast in Delaware,40,8.246445,-4.6610823
Is it chillier in Mint Hill FM,30,7.2209888,-1.947653
whats the forecast for Greece,29,8.257151,-4.4557357
Is it cold in PW?,17,7.851533,-2.2773461
"What's the forecast for Francisco, Netherlands Antilles around eleven pm?",73,7.7046223,-4.4756985
What is the weather at the current position,43,7.8831663,-2.8920562
What is going on with the weather far from my current location,62,7.6861773,-2.7870185
What's the weather supposed to be like in Elmer City,52,7.8141127,-3.1478703
what is the Tal Chhapar Sanctuary forecast for cold weather,59,7.302771,-4.1613784
Will it be hot on orthodox good friday in Michigan and close-by,63,7.337508,-2.3625295
Is it cold in North Carolina,28,7.980395,-2.6561725
What is the weather forecast in 2 seconds for South Carolina,60,7.9305515,-4.1383567
what will the weather be like in fourteen hours in Eastville,60,7.6461067,-3.1558666
What is the current temperature here,36,7.9536996,-2.7226088
Is it going to be hot in Karthaus at 7 AM?,42,7.47363,-1.9845153
"What is the weather forecast for three in Whitewood, Rhode Island",65,7.948014,-4.3236675
What is the cloud coverage in my current place,46,6.8349767,-2.836661
What is the weather forecast for Siler City Russia,50,8.223442,-4.2705865
Is it going to be warm here for brunch,38,7.7580256,-2.2707028
"Will it get colder in Camp San Saba, Latvia in one minute and eight seconds ",76,7.8078322,-2.6501133
What will the humidity be like on june eighteenth in my current location,72,6.9790893,-2.338426
Will it rain in Paisley,23,7.1183724,-3.4157598
Will it feel nice here or within the same area,46,6.8399653,-2.1404924
What's the weather forecast for my current spot?,48,7.894038,-4.421307
Tell me if snow is in the forecast for Teterville,49,6.629428,-3.7097933
"What will the weather be like on feb. sixth, 2024 at Blanco State Park",70,7.425408,-3.362094
Tell me if it will it be windy in Grizzled Squirrel Wildlife Sanctuary,70,6.8395567,-3.9282517
What will the weather be like in India at 02:55:25 AM,53,7.819823,-3.2596476
"Is it cold in Breckenridge, Colorado?",37,7.9468217,-2.4401371
What will the weather be in Corcovado National Park on december the fifth?,74,7.4069567,-3.2119765
Is it warm in Botna,19,7.755178,-2.3036065
"What is the weather forecast for june the third in Rileyville, CO",65,8.087251,-4.5714064
"What's the temperature today in Griffin, NE?",44,7.796741,-2.6392825
what is the forecast for Swain,30,8.06445,-5.005487
What is the weather forecast in Spaulding Morocco,49,8.172896,-4.527597
"Will it be freezing in Poland on July 5, 2032",45,8.476563,-1.8438728
Give me the weather forecast for Zambia,39,8.263,-4.82342
what will the weather be in Norway at sunset,44,8.0266485,-3.403846
Will it snow in AMy,19,6.3166957,-3.5073047
Is it going to get any hotter in Kerrick?,41,7.635521,-1.8798916
is AZ has chilly weather,24,7.9590597,-2.7848966
"Will the weather be stormy on january the 15th, 2026 in the Federated States Of Micronesia",90,7.2882786,-3.1487176
What's the weather in Andorra,29,7.577351,-3.0585525
will it be colder in AZ than TX today,37,8.028586,-2.4836905
what is the Baotianman National Nature Reserve forecast,55,7.6116285,-4.436522
what is the weather forecast for Ridge Farm New York,52,8.236819,-4.655824
When will it be hot in Millvale,31,7.3194976,-2.1357973
What is the forecast in Wild River State Park,45,7.1859813,-4.128169
Will it get overcast in La Dolores?,35,6.8670855,-3.0054998
"Is there a freezing forecast for Minto, Nicaragua?",50,8.192305,-4.405569
Will it be freezing in New Preston Venezuela?,45,8.444836,-1.8670452
Show me a forecast for Malaysia,31,7.944884,-4.9544053
