text,text_length,x,y
show me the schedule of movie Michel Strogoff,45,-4.731156,5.088017
find Dipson Theatres animated movies,36,-4.1548567,3.90666
What movie house is playing the animated movies nearest?,56,-1.7917707,4.462031
Can I see the upcoming movie schedule?,38,-4.309844,5.476567
find a movie house nearest for films,36,-1.8224072,4.3412724
What films are playing at Dipson Theatres and when ,51,-4.0669813,4.009166
Which animated movies are playing in the neighbourhood ?,56,-2.9267008,6.257681
when is Good Will Evil playing at Loews Cineplex Entertainment,62,-5.907333,4.7883387
What time is G-Men vs The Black Dragon playing at Harkins Theatres,66,-2.832272,3.8351657
What are the movie schedules at ArcLight Hollywood,50,8.757295,3.8859189
show me the schedule of movies in Pacific Theatres,50,-4.157536,4.828232
What time is AMC Theaters playing Unnikrishnante Adyathe Christmas,66,-4.751654,4.0638924
What cinema is Health Warning playing in eleven hours?,54,-3.3844705,3.591232
Is Dummy playing at two a.m.?,29,-2.9060483,3.8824441
I'd like to see movie schedules for animated movies around here,63,-3.5341918,6.4200106
Find out what films are being played in the neighbourhood,57,-2.114207,5.261527
"When is Fine, Totally Fine playing?",35,-2.297644,3.718069
What films are playing in the neighbourhood,43,-2.128962,5.286219
what day does the movie Star of the Circus play at ten PM,57,-2.7995136,4.0731473
what time can i see Older Office Lady: Using Her Seductive Tongue at Star Theatres,82,-2.6959133,3.4271588
What movies are playing Douglas Theatre Company,47,-3.2816095,3.924401
What time is Adam at Six A.M. playing,37,-2.694811,3.8229766
Show me the closest 12 A.M. showing at a movie house of an animated movie,73,-1.9068058,4.2031574
When and where can I watch National Priority?,45,-1.8337678,3.3207452
Show me the new showings for animated movies in the neighborhood,64,-2.971415,6.248347
Where can I watch The Sword of Ali Baba at two p.m.?,52,-1.7687892,3.5261734
show movie schedules for animated movies in the neighbourhood,61,-3.274288,6.7732515
Is Sheikh Chilli playing,24,-1.1162412,-1.5177712
I'd like to watch Three Word Brand at the cinema,48,-3.0766504,3.3620822
Show me movie times for movies in the neighborhood,50,-2.1252062,5.094455
Find animated movies at Landmark Theatres at dinner time.,57,-4.0537224,3.8732378
find animated movies nearby,27,-3.108634,6.086426
what's the movie schedule at National Amusements,48,-3.7864764,5.754986
What is the movie schedule at MJR Theatres?,43,-4.1387105,4.625806
What movie times,16,-2.5723505,4.751705
show me the schedule of films in Cobb Theatres,46,-3.9765284,4.8756256
What time is The Toll of the Sea playing,40,-2.5870438,3.916073
ticket for The Perfect Man at Dickinson Theatres at 10 A.M.,59,-3.0379808,3.9330106
movie schedules for animated movies playing in the neighbourhood,64,-3.2705126,6.761477
What is the nearest movie theatre playing Kate y Leopold?,57,-3.1576474,3.6536493
Find movie times for Century Theatres.,38,-3.797473,4.423191
Where can I see Joy of Learning?,32,-0.11678235,3.1237261
What films are at IMAX Corporation at 11 p.m.,45,-3.3474755,5.4269342
Where is Nichiren to Moko Daishurai playing,43,-0.62951374,-1.4873999
Find me showtimes for animated movies in the neighbourhood.,59,-2.5053554,2.9442773
find movie schedule in Pacific Theatres,39,-4.1865573,5.168946
Does Pacific Theatres have animated movies starting in 1 minute?,64,-4.455245,4.4314947
Where is Shake Your Powder Puff playing,39,-1.9689186,-2.1402876
I'd like to watch The Slender Thread at 6 PM,44,-2.294246,3.3397067
Where is the closest cinema that features animated movies,57,-4.1065774,3.5283618
Is The Young Guard playing at the closest cinema,48,-3.2437708,3.4979413
What movies are playing at the nearest cinema,45,-3.4900613,3.3251982
Find out what films are playing at North American Cinemas,57,-3.2733712,4.7861156
can i have the local movie times,32,-2.4551072,4.631803
I'm wondering what movies will be laying around here.,53,-2.7714977,4.9453955
Please show me the movie schedule for animated movies playing in the neighborhood.,82,-3.2059865,6.6530356
what movie is at Loews Cineplex Entertainment,45,-5.9040265,4.782409
find National Amusements showing The Trouble with Harry,55,-3.6842098,5.800257
"find The Good Girl at a movie house
",36,-1.744195,4.1194468
Can I get the Butterfly Crush showings,38,-1.3217883,-1.8097113
Tell me the closest movie house playing Black Rage,50,-1.9351411,4.217956
show me the schedule of movie The Da Vinci Code,47,-4.569802,5.2323546
What are the movie schedules for the Caribbean Cinemas,54,-3.441034,4.675125
Find the movie times now.,25,-2.3660922,5.018076
When is The Blood of Others playing?,36,-2.4054375,3.6731288
Where is The Toxic Avenger II playing,37,-1.9059149,3.5746088
When is The Woman going to be scheduled at the closest movie house?,67,-2.4083593,4.322319
Can I see movie schedules for movies this evening in the neighbourhood?,71,1.7745242,1.4384114
List movie schedule.,20,-4.710821,5.5800133
Show me movie schedules,23,-4.7119994,5.2452364
Are any animated movies scheduled for release in Mann Theatres?,63,-3.553114,4.414908
I need to know when Sensation in Morgan's Creek is playing,58,-2.213309,3.6737366
find On Dress Parade,20,-1.0505956,-0.63094074
What are the movie schedules for movies playing in the neighborhood ,68,1.7572789,1.4378991
show movie schedule at Cinemark Theatres,40,-4.115614,4.4714
movie schedule  of films around here,36,-3.9204519,5.2102995
Which animated movies are playing in the neighbourhood and when?,64,-2.8716106,6.2513194
Can i get the movie schedules for Speakeasy Theaters?,53,-3.979199,5.4721303
What time is Sontha Ooru playing,32,-2.8293464,3.8731358
What time is Doc Savage: The Man of Bronze playing,50,-2.7184346,3.6955118
Let me know when The Maiden Danced to Death will be screened at a cinema.,73,-2.851782,3.5079427
where can i watch Willy Wonka & the Chocolate Factory,53,-2.1661108,3.674047
find Death Is Called Engelchen at Neighborhood Cinema Group,59,-1.9546493,4.664073
What movie theatre playing animated movies is the closest,57,-3.948562,3.7036023
when can i see Dinosaur from the Deep,37,0.17813285,4.292749
find Careless Love,18,-0.5383748,3.4516702
When is The Bleeding House playing at Amco Entertainment?,57,-4.794993,4.0650268
"What are the movie times
",25,-2.628342,4.730431
what movies are showing in the neighbourhood,44,-2.1239624,5.287423
Check the movie timings for Cracked Nuts at Southern Theatres.,62,-2.8757777,4.1750503
What film is playing in the neighbourhood,41,-2.133852,5.2889004
Fine the movie schedule for Warren Theatres.,44,-3.9312327,4.4887652
Fine movie times for Loews Cineplex Entertainment.,50,-5.9033456,4.786427
When is The Blood Stain playing at the movie house?,51,-2.301054,3.8461483
find a movie schedule in the neighborhood for films,51,1.6958985,1.4943395
Can I get the movie schedule for Loews Cineplex Entertainment?,62,-5.8699913,4.789961
show me the movie schedule,26,-4.556565,5.243837
Please tell me movie times,26,-2.6072795,4.6839347
show me the schedule of movie Interview: The Documentary in Loews Cineplex,74,-5.9101033,4.7994013
find Heat Wave,14,7.8788166,-2.7308486
I'd like to watch Abbott and Costello Meet Captain Kidd at the nearest cinema,77,-2.5363102,3.3945854
What films are playing around here,34,-2.7292159,5.0441265
find Kerasotes Theatres showing animated movies,47,-2.7660334,2.739179
What time is Project Censored the Movie playing at the movie house,66,-2.3491845,4.222747
Is The Skull playing at Loews Cineplex,38,-5.894069,4.7748766
Which movies are being screened around here?,44,-2.7341228,5.0244074
give me the movie schedule for films in the area ,49,-3.7881594,5.0646787
I need information on movie schedules,37,-4.5474935,5.6978264
She me that movie schedule,26,-4.436364,5.4003057
What are the selections of films that are being shown at Cinemark Theatres?,75,-3.4620607,3.792039
find a cinema showing The Mandrake nearest at one o'clock,57,-3.34676,3.7265036
What are the movie times for movies close by,44,-2.8337758,5.255199
Tell me the movie schedule for Warren Theatres,46,-3.969438,4.5293784
Is Romulus and the Sabines playing at the nearest cinema at ten,63,-3.3948233,3.3542717
Is The Angelus playing at the movie house at dinner time?,57,-2.22327,3.9781435
I would like to see the closest cinema playing films.,53,-3.4251106,3.375201
Find movie schedules for IMAX Corporation.,42,-3.6365225,5.400858
What is the movie schedules for animated movies in the neighbourhood,68,-3.258245,6.708935
What are the movie times for animated movies in the area?,57,-3.0955892,5.969206
What is the movie schedule for movies in the neighbourhood ,59,1.7660079,1.4409434
give me the movie schedules for Southern Theatres,49,-3.9416602,4.416541
What is the movie schedule of animated movies nearby,52,-3.4675536,6.3971305
Are there any animated movies playing in the neighborhood?,58,-2.9390287,6.258884
What time is Return from Hell playing at the nearest movie house,64,-2.097534,4.135473
whats the closest movie house showing Medal of Honor,52,-1.9441546,4.191176
When is Eye of the Spider playing at Regal Entertainment Group?,63,-3.2468257,3.743115
when are animated movies playing at Goodrich Quality Theaters,61,-4.575121,6.4740486
Find the movie schedule for National Amusements.,48,-3.7957675,5.751033
When is You Walk So Softly playing at Kerasotes Theatres,56,-2.775368,2.7368965
Find me a showing of The Vanquished that starts nine hours and 1 second from now.,81,0.24323118,3.0180147
"When is For One Night playing at Loews Cineplex Entertainment?
",63,-5.8725033,4.7752986
I'd like to watch Mission to Mir,32,-1.8481013,3.3691633
show the schedule of movie The Statue,37,-4.8291054,5.2352495
When is Em4Jay playing at the movie theatre?,44,-3.1816647,3.6104207
Find the movie schedule.,24,-4.180486,5.724277
What are the movie times for films playing nearby,49,-2.58379,4.719756
What are the current movie schedules for AMC Theatres?,54,-4.894628,4.131408
Is The Country Doctor on the schedule at any theater near me?,61,-3.7186263,4.60604
Are there any animated movies playing at the closest cinema?,60,-4.035388,3.6133335
Where can I watch The Mark in a cinema,38,-3.0168204,3.3785124
what movies are on the movie schedules for five hours from now in the neighbourhood,83,1.7698282,1.4380727
What's the movie schedule for animated movies in the neighborhood,65,-3.2806242,6.741162
what is the movie schedule for animated movies playing close by,63,-3.444176,6.382128
What time are films showing at KB Theatres,42,-4.080594,4.266104
show the movie schedules and films in the area,46,-3.8373594,5.0708466
show me the movie schedules,27,-4.6953998,5.281228
I'd like to see movie times for animated movies playing in the neighborhood that are starting now.,98,-2.7704494,5.7039585
I'd like to watch I Wish at the nearest movie theatre,53,-2.6563191,3.418682
What movie house is showing Flower and Snake at 08:56:29?,57,-1.9675393,4.18282
show movie schedules,20,-4.9436345,5.1332164
what movie theatre is showing Manorama Six Feet Under,53,-2.6528904,3.606802
When is Scaramouche playing?,28,-0.4580084,-1.8352442
show me the schedule of Outlaw of Gor at nearest movie house at 5 A.M.,70,-3.1866372,4.63143
What time is Tommy and Quadrophenia Live playing at Marcus Corporation,70,-2.9027774,4.358883
Find the schedule for The Tale of Sweeney Todd at seven o'clock.,64,-3.5529761,4.6977916
find start time in 12 seconds for National Bomb,47,7.319694,-2.7615178
When will Third Person Singular Number be playing?,50,-2.6535287,3.6957688
Where is Project A Part II playing?,35,-1.6632009,-2.0818963
Which films are playing at the IMAX Corporation?,48,-3.3233721,5.432854
find Half a Truth,17,-0.3675746,4.0721965
showtimes for the closest movie theatre that is showing Operation Autumn,72,-2.505403,3.0647757
What theater is playing Haunted Honeymoon ,42,-3.0589468,3.4650946
List movie times at Harkins Theatres,36,-3.6574585,4.1406007
What animated movies are showing in the neighborhood ,53,-2.9883907,6.2580104
Find time for All About Hash,28,4.351065,2.0597153
What movie schedules are at National Amusements,47,-3.809391,5.7802796
Can you tell me the movies playing at United Paramount Theatres,63,-3.626652,4.157377
Find time for Ace of the Saddle,31,-0.5368104,3.7448993
Is The Day of the Beast playing at three p.m.?,46,-2.6938806,3.7575471
What films are scheduled around here?,37,-3.5997021,5.3501706
Is A Tree Grows in Brooklyn playing in one hour,47,0.6368922,5.055693
show the movie schedule,23,-4.866447,5.2319984
find films with movie schedules that are nearby,47,-3.7948298,5.0987
Which animated movies are playing at the nearest movie house?,61,-1.8016094,4.4224834
find Hear Me Good,17,0.031835675,3.0669122
what is playing for movies at B&B Theatres,42,-3.7563546,4.200127
what movies are at Loews Cineplex,33,-5.905792,4.7802014
At AMC Theaters what is the movie schedule?,43,-4.889497,4.124921
can i get the movie schedule for Goodrich Quality Theaters,58,-4.5697727,6.407347
Tell me what movies are at AMC Theatres.,40,-4.7511907,4.1002693
What time is High Schools playing,33,-2.6823635,3.9491217
Find me The Age for Love playing at the closest movie house.,60,-1.8332773,4.0779786
Find the movie schedule for B&B Theatres.,41,-3.9270332,4.3878083
Where is the closest cinema playing Soapsuds and Sapheads,57,-3.9774811,3.5358384
Can I get the showtimes for the closest movie theatre that has the newest films.,80,-2.4325716,3.0408294
Let me have the movie schedules for General Cinema Corporation,62,-3.635127,5.05472
Go to movie times at IMAX Corporation,37,-3.5032718,5.397166
Find the schedule for The Tooth Will Out at sunrise.,52,-3.6225884,4.785564
What is the movie schedule like,31,-4.3982882,5.6103773
I want to see movie times at Neighborhood Cinema Group.,55,-2.1809819,4.9308815
I need to see some movie schedules,34,-4.4603434,5.592009
What is the movie schedule for Train,36,-4.4124784,5.641159
What time is Mighty Morphin Power Rangers: The Movie at Magic Johnson Theatres?,79,-3.6905122,3.864155
When can I catch a screening of Shivers in Summer?,50,7.672239,-2.50257
What time is Ghostbusters - Acchiappafantasmi playing at IMAX Corporation,73,-2.9043443,4.1798916
What theater is playing Death Drums Along the River at 5 PM,59,-2.729443,3.8102565
Show me the movie schedule for Star Theatres,44,-4.1223826,4.655763
Find the closest cinema playing Little Red Monkey.,50,-4.007576,3.5494783
Find the schedule for The Kentuckians.,38,-3.6952958,4.818447
I need movie times at Fox Theatres around zero PM,49,-4.518789,4.575157
There can I find The Beggar Maid playing,40,4.1331906,2.0130458
find nearby films with movie schedules,38,-3.7843904,5.11769
Where is the nearest cinema that is playing films,49,-3.4244115,3.3213825
Showtimes for animated movies in Malco Theatres?,48,-3.2949233,2.6129925
show me the schedule of The Loves of Letty in cinema closest,60,-3.80483,4.341855
Which movies are playing in the neighborhood?,45,-2.1896307,5.2657146
What movie theatre is playing The Deaths of Ian Stone,53,-2.969067,3.5036695
What are the movie times for films nearby?,42,-2.5711608,4.6805377
What are the movie times for the Marcus Corporation,51,-2.9743078,4.6188917
What is the local movie schedule,32,-4.469792,5.668069
Find movie schedules at IMAX Corporation,40,-3.6469057,5.400444
What time is High Spirits playing?,34,-2.5812907,3.9539347
What is the nearest movie theatre playing The Collaborators,59,-3.2395964,3.6854453
find a movie schedule for United Paramount Theatres,51,-3.931305,4.4603305
Show me the movie schedule for Neighborhood Cinema Group,56,1.7424613,1.4532175
Find time for movies at the closest cinema,42,-3.5339131,3.5843472
SHow me the nearest movie house showing Moron 5 and the Crying Lady,67,-1.4718128,4.1346707
Which animated movies are playing at the nearest movie house?,61,-1.7922266,4.4235616
What is the nearest movie house playing New York Melody,55,-1.980096,4.197735
Find movie schedules.,21,-5.2051253,6.1523433
When is Crime and Punishment U.S.A. showing?,44,-2.265573,4.3639297
Shoe the movie showings for the closest cinema showing international movies,75,-3.5676272,3.3474853
find Set the Thames on Fire for seventeen,41,-1.0232756,2.5546956
Show the movie schedule for Cooper Foundation at 9 o'clock,58,-2.6484265,5.6953344
What time are the animated movies starting at the nearest movie house?,70,-1.8755096,4.3591356
What movies are playing at Marcus Corporation?,46,-2.9697201,4.6612496
find Naomi & Wynonna: Love Can Build a Bridge,45,-0.25320867,3.1421127
Is The Johnstown Flood playing,30,-2.2463982,3.5064223
find movie schedules for me,27,-5.0570946,6.0330296
Give me the movie times at Warren Theatres.,43,-3.7270875,4.308133
Find the movie schedule for Great Escape Theatres.,50,-3.905782,4.472315
Find the movie schedule for Amco Entertainment 1 minute from now.,65,-4.9451013,4.1865206
can I get the movie times,25,-2.5710254,4.719925
I want to see the movie schedule for North American Cinemas,59,-3.4214494,4.8585176
Is The Big Job playing at the nearest cinema?,45,-3.4175243,3.3072374
Find a movie schedule.,22,-2.3159225,13.185279
I'd like to watch movies at the closest movie theatre,53,-2.7759686,3.544924
What is the nearest cinema playing The Oak,42,-3.3882954,3.2630172
What movies are scheduled at the nearest movie theatre?,55,-3.3550975,3.638968
What movies are playing at Cineplex Odeon Corporation?,54,-6.3456006,4.9003153
Show the latest animated movies movie times for the nearest movie house,71,-1.7688442,4.4655876
Find the movie schedule for animated movies close by.,53,-3.4775581,6.446484
what time is Bhoot Returns showing at Douglas Theatre Company,61,-3.4263637,4.370007
Is A Short Film About Killing at North American Cinemas,55,-3.2544188,4.78481
What are the movie times for films playing in the area?,55,-2.5311925,4.5316744
Find time for Hendthighelbedi at the nearest cinema,51,-3.44893,3.7321107
Find the schedule for for Corn at eleven A.M. at Loews Cineplex Entertainment.,78,-5.8576083,4.816309
What time will the Amco Entertainment  be plying The Teeth of the Tiger,71,-4.785302,3.9779174
Find movie schedules for  United Paramount Theatres.,52,-3.9873002,4.4797807
What animated movies are playing at the closest movie theatre,61,-3.9685323,3.6999922
Find the schedule for To Shoot an Elephant at the nearest movie theatre.,72,-3.6992774,3.9685392
find the nearest movie house with Pirates of the 20th Century,61,-1.80614,4.3184185
What animated movies are playing at the closest movie theatre,61,-3.9838462,3.743839
find close by movies movie times,32,-2.888058,5.205677
I need movie schedules,22,-4.5322747,5.6585817
Show me when and where I can see Song of Summer,47,-2.1819642,-0.5277481
I'd like to watch movies at the closest movie theatre,53,-2.6487417,3.4308624
When is Man in Outer Space playing at Megaplex Theatres,55,-4.2499604,4.0297627
find a movie schedule,21,-2.3154466,13.180783
find A Feather in Her Hat at Magic Johnson Theatres,51,-3.77396,3.8989935
what is the movie schedules for animated movies nearby,54,-3.4242492,6.3608294
What animated movies are there nearby?,38,-3.1577218,6.0587463
"Show me the nearest movies at movie theatre for twenty one o'clock
",67,-3.2135928,3.7369902
i want to watch Ghosts of the Abyss at Kerasotes Theatres,57,-2.7280703,2.802614
Find the movie schedule.,24,-4.175984,5.7739863
CAn I get the the showtimes for The Jade Faced Assassin cinema?,63,-2.311024,3.0502176
What time is The Christmas Toy playing at Loews Cineplex,56,-5.839808,4.7626524
I want to see the movie schedules for animated movies around here.,66,-3.5525851,6.451863
what kind of films are at the closest movie house,49,-1.9043245,4.262103
What are the movie times at Goodrich Quality Theaters?,54,-4.5805163,6.464507
where is The Cycle playing,26,-3.1954317,4.0104856
What movie times are there for 5 p.m.?,38,-2.565509,4.7329087
Where is the nearest cinema playing Rainbow Eyes that starts in one minute?,75,-3.474012,3.4922817
Is Thenaruvi playing at the Douglas Theatre Company in one hour?,64,-3.0543864,4.0126615
Find movie schedule for animated movies in the area,51,-3.4626799,6.5556374
Show me the movie schedules for any animated movies playing close by?,69,-3.4365442,6.371381
show movies at the nearest movie house,38,-1.7969974,4.3290014
I'm wondering if I can watch Heyy Babyy at a cinema.,52,-3.0875902,3.3111234
List movies by movie times in the neighbourhood,47,-2.049807,5.2033734
movie schedule at Speakeasy Theaters,36,-4.004632,5.467321
What movies are playing nearby?,31,-2.6221495,4.968423
find the closest cinema with animated movies,44,-4.109489,3.533795
What animated movies are playing at the nearest movie theatre?,62,-3.975784,3.7039206
Provide me the movie schedules,30,-4.5631304,5.6028805
I'd like to watch movies at Amco Entertainment,46,-4.7462544,4.0700464
"find National Amusements with Honey, I Shrunk the Kids",54,-3.640096,5.737318
I need movie times in the area for any type of movies,53,-2.477847,4.668337
Where is the nearest movie theatre I can go watch films today?,62,-2.992084,3.5519743
What animated movies are playing AMC Theaters,45,-4.7647824,4.083677
What time is Three Cuckoo Clocks playing?,41,-2.5036874,4.0523047
Show movie times at Kerasotes Theatres,38,-2.8074815,2.6888847
"What time is Balkan Rhapsodies: 78 Measures of War playing at Malco Theatres?
",78,-3.105964,2.8488784
When is Robotix playing?,24,-2.8477838,3.8576763
show me the schedule of movie The Duchess of Langeais in cinema,63,-3.9775324,4.9753146
Find the movie schedules for Speakeasy Theaters.,48,-3.989806,5.4409533
Show me movie times at the Pacific Theatres for the movie The Hot Rock,70,-2.7518933,4.4466953
whats the nearest movie house showing animated movies,53,-1.7552785,4.446221
find movies nearest to a movie house,36,-1.8349841,4.3105693
Is Warhead playing at AMC Theaters,34,-4.840423,4.0974917
Is Judgment Day: The John List Story playing at Megaplex Theatres?,66,-3.9681258,3.9824011
What time is Too Young to Marry showing,39,-2.0893595,3.743064
When is The Jailbird showing at United Paramount Theatres,57,-3.4940543,4.1052785
Are there any animated movies playing at the Mann Theatres?,59,-3.5991495,4.097588
What time is the nearest cinema playing The Hopes of Blind Alley,64,-3.4668396,3.4349334
Can I get the movie times for films in the neighborhood?,56,-2.079009,4.9675055
What movie theatre has A Matter of Wife... And Death,52,-3.0125296,3.55318
what time is The Graduate showing at Caribbean Cinemas,54,-3.3889334,4.6278014
"What is the movie schedule at Caribbean Cinemas
",48,-3.4238575,4.7084417
Find the schedule for films at night at Great Escape Theatres.,62,-3.8362687,4.4191403
Showtimes for the Alamo Drafthouse Cinema for todays movies.,60,-6.726504,6.6968513
"what are the movie schedules for Great Escape Theatres
",55,-3.925685,4.4451547
find meal time movie times close by for movies,46,-2.7524664,5.1077824
I'd like to watch The Freckled Fish at 00:47:43 at Magic Johnson Theatres,73,-2.6461315,3.4523335
i need movie times for movies in the area,41,-2.4382927,4.7193313
Give me the showtimes for animated movies at the nearest cinema.,64,-2.432832,3.0366666
Give me movie times,19,-2.6201549,4.647632
find Shanghai Express,21,5.826802,2.2032483
Find time for the movie schedule ,33,-4.1575093,5.685783
"Where is the closest movie theatre playing Yo, robot",52,-3.725401,3.7626219
When is Stripped to Kill II: Live Girls playing at the nearest movie house?,75,-1.8171529,3.9708705
what movies are showing nearby,30,-2.664652,5.0108585
Which films are playing at Malco Theatres?,42,-3.3415658,2.5641782
Find the movie schedules,24,-5.180183,6.126751
find The Watcher at United Paramount Theatres,45,-3.595279,4.173072
When is Percy Jackson playing at the movie theatre?,51,-2.9188368,3.6126416
what time is Utamaro and His Five Women showing at Alamo Drafthouse Cinema,74,-6.7314553,6.700354
Find the schedule for the closest films at a cinema at meal time.,65,-3.733234,4.646638
What movie times are at Bow Tie Cinemas?,40,-3.464175,4.4673886
I'd like to see a movies  at the nearest movie house,52,-1.9515324,4.2113743
Which films are playing at the closest cinema?,46,-3.5087943,3.3392258
What is the movie schedule in five minutes for movies playing in the neighborhood ,82,1.7617645,1.4354054
I want the nearest movie house with The Debtors,47,-1.9000653,4.2241583
List the movie schedule for Regal Entertainment Group theater.,62,-4.4210725,4.744995
Find the schedule for animated movies in the neighborhood.,58,-3.3101425,6.7432356
"Where is the closest cinema playing A Drink in the Passage
",59,-3.4663866,3.3118975
Where is The Wilderness Trail playing,37,7.2063847,-2.7373197
find a movie theatre with Life and Death,40,-3.1361468,3.715101
Can you provide me with movie schedules for Century Theatres?,61,-4.0103426,4.436845
What time does The Maze start at Cineplex Odeon Corporation,59,-6.343588,4.9008803
Please find the movie schedule for animated movies playing in the neighbourhood ,80,-3.2563734,6.7270746
when is Our Story showing next at North American Cinemas,56,-3.2428877,4.8176646
What time is The Graduates of Malibu High playing at Cobb Theatres,66,-2.9628835,3.812833
Fine a movie schedule.,22,-4.420468,5.623953
Can i get todays showtimes for Le Flic de Beverly Hills 2?,58,-2.3816087,2.9936428
Can I get The Marine 2 showtimes.,33,-2.3578165,2.9950926
Where is Mother and Child plkaying,34,4.250311,2.3394654
Is You Will Meet a Tall Dark Stranger at Bow Tie Cinemas,56,-3.497698,4.4131837
What time is Sundown: The Vampire in Retreat showing,52,-1.314787,3.8067675
"What animated movies are playing at KB Theatres
",48,-4.0519686,3.956244
What movie schedule are in the area for animated movies,55,-3.4722464,6.4584913
show movie schedules for Fox Theatres,37,-4.45714,4.653798
